{
  "listener_transport": "loopback_h1",
  "process": "PROCESS-22009",
  "receipts": [
    {
      "assertion_binding": "declaration",
      "assertion_ids": [
        "publication.incompatible_or_gap",
        "publication.inflight_old_revision",
        "publication.lkg_restart"
      ],
      "execution": "real_hirouted_native_provider",
      "id": "authority.live_publication",
      "source": "tools/e2e-harness/tests/p0_gateway_request_authority.rs",
      "source_sha256": "sha256:8cfc3436d586c8bc274efd80d6f018455ce5d3ed31f9e0665c8573c62b8c9cb6",
      "symbol": "production_hirouted_live_publication_control_pins_cutover_and_preserves_lkg_on_nack",
      "test_target": "p0_gateway_request_authority"
    },
    {
      "assertion_binding": "declaration",
      "assertion_ids": [
        "gateway.isolated_native_listener",
        "authority.shared_entry_selects_alias_plan",
        "authority.unknown_or_unauthorized_alias",
        "authority.catalog_and_etag",
        "authority.alias_budget",
        "gateway.loopback_h1"
      ],
      "execution": "real_hirouted_native_provider",
      "id": "authority.wire_listener",
      "source": "tools/e2e-harness/tests/p0_gateway_request_authority.rs",
      "source_sha256": "sha256:8cfc3436d586c8bc274efd80d6f018455ce5d3ed31f9e0665c8573c62b8c9cb6",
      "symbol": "production_hirouted_wire_authority_catalog_deadline_and_actual_restart",
      "test_target": "p0_gateway_request_authority"
    },
    {
      "assertion_binding": "declaration",
      "assertion_ids": [
        "protocol.responses_to_responses",
        "protocol.responses_to_chat_completions",
        "protocol.responses_to_messages",
        "protocol.chat_completions_to_responses",
        "protocol.chat_completions_to_chat_completions",
        "protocol.chat_completions_to_messages",
        "protocol.messages_to_responses",
        "protocol.messages_to_chat_completions",
        "protocol.messages_to_messages",
        "protocol.exact_native_request",
        "protocol.exact_client_projection",
        "protocol.fragmented_ingress",
        "protocol.preconnect_rejection"
      ],
      "execution": "real_hirouted_native_provider",
      "id": "protocol.nine_native_pairs",
      "source": "tools/e2e-harness/tests/p0_gateway_protocol/production_matrix.rs",
      "source_sha256": "sha256:a9ec681781bc52347e3df3a14f0916a557c43323ca1cca812e1e68ffe57b3f92",
      "symbol": "production_matrix::protocol_real_hirouted_executes_every_native_protocol_pair_and_rejects_before_provider",
      "test_target": "p0_gateway_protocol"
    },
    {
      "assertion_binding": "runtime_assertion_marks",
      "assertion_ids": [
        "protocol.tool_round_trip",
        "protocol.sse_fragmented_semantics",
        "protocol.native_tool_identity",
        "protocol.stream_usage_terminal",
        "protocol.namespace_native_acceptance",
        "protocol.namespace_upstream_rejection",
        "protocol.continuation_owner_affinity",
        "protocol.continuation_preconnect_refusal"
      ],
      "execution": "real_hirouted_native_provider",
      "id": "protocol.tool_and_sse",
      "source": "tools/e2e-harness/tests/p0_gateway_protocol/continuation.rs",
      "source_sha256": "sha256:7e420079c22a789cdb2340fa4aef638728fe48b8550cf9a39d47cbd01050aebd",
      "symbol": "continuation::production_tool_continuation_restores_native_id_and_fails_closed_outside_scope",
      "test_target": "p0_gateway_protocol"
    },
    {
      "assertion_binding": "declaration",
      "assertion_ids": [
        "planner.frozen_order_consumed",
        "planner.reason_ledger_identity"
      ],
      "execution": "real_hirouted_native_provider",
      "id": "planner.runtime_consumption",
      "source": "tools/e2e-harness/tests/p0_gateway_runtime.rs",
      "source_sha256": "sha256:bd377611bc6bc162f7eb207488a0c06271f0bb7a7a40f18a50894cc41c433ee2",
      "symbol": "real_listener_consumes_planner_order_and_binds_reason_ledger_identity",
      "test_target": "p0_gateway_runtime"
    },
    {
      "assertion_binding": "declaration",
      "assertion_ids": [
        "runtime.binding_fault",
        "runtime.frozen_budget",
        "runtime.precommit_fallback"
      ],
      "execution": "real_hirouted_native_provider",
      "id": "runtime.fallback",
      "source": "tools/e2e-harness/tests/p0_gateway_runtime.rs",
      "source_sha256": "sha256:bd377611bc6bc162f7eb207488a0c06271f0bb7a7a40f18a50894cc41c433ee2",
      "symbol": "real_hirouted_reaches_native_provider_and_falls_back_before_commit",
      "test_target": "p0_gateway_runtime"
    },
    {
      "assertion_binding": "declaration",
      "assertion_ids": [
        "runtime.context_hold.simple_to_complex",
        "runtime.context_hold.complex_to_simple",
        "runtime.context_hold.rebuild",
        "runtime.context_hold.responses_search_append"
      ],
      "execution": "real_hirouted_native_provider",
      "id": "runtime.context_hold.classified",
      "source": "tools/e2e-harness/tests/p0_gateway_context_hold.rs",
      "source_sha256": "sha256:9a299142be261057edceba9ab16d0242705e86f0da0d83585999836e929c8511",
      "symbol": "real_hirouted_holds_only_inside_each_classified_branch",
      "test_target": "p0_gateway_context_hold"
    },
    {
      "assertion_binding": "declaration",
      "assertion_ids": [
        "runtime.context_hold.success_only",
        "runtime.context_hold.fallback_origin"
      ],
      "execution": "real_hirouted_native_provider",
      "id": "runtime.context_hold.fallback",
      "source": "tools/e2e-harness/tests/p0_gateway_context_hold.rs",
      "source_sha256": "sha256:9a299142be261057edceba9ab16d0242705e86f0da0d83585999836e929c8511",
      "symbol": "real_hirouted_holds_the_successful_fallback_and_releases_it_on_rebuild",
      "test_target": "p0_gateway_context_hold"
    },
    {
      "assertion_binding": "declaration",
      "assertion_ids": [
        "protocol.previous_response_id_preconnect_rejection"
      ],
      "execution": "real_hirouted_native_provider",
      "id": "protocol.previous_response_id",
      "source": "tools/e2e-harness/tests/p0_gateway_context_hold.rs",
      "source_sha256": "sha256:9a299142be261057edceba9ab16d0242705e86f0da0d83585999836e929c8511",
      "symbol": "real_hirouted_rejects_opaque_previous_response_id_before_provider_io",
      "test_target": "p0_gateway_context_hold"
    },
    {
      "assertion_binding": "declaration",
      "assertion_ids": [
        "runtime.multiple_keys",
        "runtime.quota_key_handoff",
        "runtime.binding_overload"
      ],
      "execution": "real_hirouted_native_provider",
      "id": "runtime.key_handoff",
      "source": "tools/e2e-harness/tests/p0_gateway_runtime.rs",
      "source_sha256": "sha256:bd377611bc6bc162f7eb207488a0c06271f0bb7a7a40f18a50894cc41c433ee2",
      "symbol": "real_listener_distinguishes_quota_key_scope_from_overload_binding_scope",
      "test_target": "p0_gateway_runtime"
    },
    {
      "assertion_binding": "declaration",
      "assertion_ids": [
        "runtime.cas_write_fault",
        "runtime.fail_closed_503",
        "runtime.zero_fallback_after_fault",
        "runtime.zero_bad_state_persist"
      ],
      "execution": "real_hirouted_native_provider",
      "id": "runtime.cas_write_fault",
      "source": "tools/e2e-harness/tests/p0_gateway_runtime.rs",
      "source_sha256": "sha256:bd377611bc6bc162f7eb207488a0c06271f0bb7a7a40f18a50894cc41c433ee2",
      "symbol": "real_listener_runtime_state_cas_write_failure_is_fail_closed_and_one_shot",
      "test_target": "p0_gateway_runtime"
    },
    {
      "assertion_binding": "declaration",
      "assertion_ids": [
        "runtime.probe_write_fault",
        "runtime.probe_zero_attempt",
        "runtime.probe_one_shot_recovery"
      ],
      "execution": "real_hirouted_native_provider",
      "id": "runtime.probe_write_fault",
      "source": "tools/e2e-harness/tests/p0_gateway_runtime.rs",
      "source_sha256": "sha256:bd377611bc6bc162f7eb207488a0c06271f0bb7a7a40f18a50894cc41c433ee2",
      "symbol": "real_listener_probe_write_failure_creates_no_attempt_and_recovers_once",
      "test_target": "p0_gateway_runtime"
    },
    {
      "assertion_binding": "declaration",
      "assertion_ids": [
        "runtime.postcommit_no_retry",
        "runtime.postcommit_provider_count"
      ],
      "execution": "real_hirouted_native_provider",
      "id": "runtime.postcommit",
      "source": "tools/e2e-harness/tests/p0_gateway_commit_boundary.rs",
      "source_sha256": "sha256:89ec48e8dbaaa9f0af21de62978b7258ddf23031743785807209e4941818c6b3",
      "symbol": "real_listener_postcommit_disconnect_never_creates_another_attempt",
      "test_target": "p0_gateway_commit_boundary"
    },
    {
      "assertion_binding": "declaration",
      "assertion_ids": [
        "replay.threshold",
        "replay.two_attempts",
        "replay.bounded_memory"
      ],
      "execution": "real_hirouted_native_provider",
      "id": "replay.threshold",
      "source": "tools/e2e-harness/tests/p0_gateway_replay.rs",
      "source_sha256": "sha256:96ec0214d8119074e3f488375a6fca51883de648b69531e92a47e6fb247a0a2c",
      "symbol": "real_hirouted_replays_threshold_below_and_above_for_two_fallbacks",
      "test_target": "p0_gateway_replay"
    },
    {
      "assertion_binding": "declaration",
      "assertion_ids": [
        "replay.owner_only_permission",
        "replay.zero_provider_on_permission"
      ],
      "execution": "real_hirouted_native_provider",
      "id": "replay.owner_only_permission",
      "source": "tools/e2e-harness/tests/p0_gateway_replay.rs",
      "source_sha256": "sha256:96ec0214d8119074e3f488375a6fca51883de648b69531e92a47e6fb247a0a2c",
      "symbol": "real_hirouted_rejects_non_owner_only_replay_root",
      "test_target": "p0_gateway_replay"
    },
    {
      "assertion_binding": "declaration",
      "assertion_ids": [
        "replay.request_capacity_limit",